{
  "catalogId": "human-design-bodygraph-topology-v1",
  "catalogStatus": "source_attributed_symbolism",
  "version": "1.0.0",
  "description": "Source-specific gate titles and Human Design BodyGraph topology. This catalog is symbolic reference data, not a biological model.",
  "biologyBoundary": "This topology catalog assigns no hormone, gland, neurochemical, physiological mechanism, developmental outcome, or predictive effect to any gate, center, or channel. Source-attributed teachings are stored separately in the correspondence catalog and do not establish biological mechanisms or individual predictions.",
  "centers": [
    {
      "id": "head",
      "name": "Head",
      "gateNumbers": [
        61,
        63,
        64
      ]
    },
    {
      "id": "ajna",
      "name": "Ajna",
      "gateNumbers": [
        4,
        11,
        17,
        24,
        43,
        47
      ]
    },
    {
      "id": "throat",
      "name": "Throat",
      "gateNumbers": [
        8,
        12,
        16,
        20,
        23,
        31,
        33,
        35,
        45,
        56,
        62
      ]
    },
    {
      "id": "g_identity",
      "name": "G / Identity",
      "gateNumbers": [
        1,
        2,
        7,
        10,
        13,
        15,
        25,
        46
      ]
    },
    {
      "id": "heart",
      "name": "Heart / Ego",
      "gateNumbers": [
        21,
        26,
        40,
        51
      ]
    },
    {
      "id": "solar_plexus",
      "name": "Solar Plexus",
      "gateNumbers": [
        6,
        22,
        30,
        36,
        37,
        49,
        55
      ]
    },
    {
      "id": "sacral",
      "name": "Sacral",
      "gateNumbers": [
        3,
        5,
        9,
        14,
        27,
        29,
        34,
        42,
        59
      ]
    },
    {
      "id": "spleen",
      "name": "Spleen",
      "gateNumbers": [
        18,
        28,
        32,
        44,
        48,
        50,
        57
      ]
    },
    {
      "id": "root",
      "name": "Root",
      "gateNumbers": [
        19,
        38,
        39,
        41,
        52,
        53,
        54,
        58,
        60
      ]
    }
  ],
  "gates": [
    {
      "number": 1,
      "title": "Self-Expression",
      "centerId": "g_identity",
      "channelIds": [
        "ch-1-8"
      ]
    },
    {
      "number": 2,
      "title": "Higher Knowing",
      "centerId": "g_identity",
      "channelIds": [
        "ch-2-14"
      ]
    },
    {
      "number": 3,
      "title": "Ordering",
      "centerId": "sacral",
      "channelIds": [
        "ch-3-60"
      ]
    },
    {
      "number": 4,
      "title": "Formulization",
      "centerId": "ajna",
      "channelIds": [
        "ch-63-4"
      ]
    },
    {
      "number": 5,
      "title": "Fixed Rhythms",
      "centerId": "sacral",
      "channelIds": [
        "ch-5-15"
      ]
    },
    {
      "number": 6,
      "title": "Friction",
      "centerId": "solar_plexus",
      "channelIds": [
        "ch-59-6"
      ]
    },
    {
      "number": 7,
      "title": "Role of the Self",
      "centerId": "g_identity",
      "channelIds": [
        "ch-7-31"
      ]
    },
    {
      "number": 8,
      "title": "Contribution",
      "centerId": "throat",
      "channelIds": [
        "ch-1-8"
      ]
    },
    {
      "number": 9,
      "title": "Focus",
      "centerId": "sacral",
      "channelIds": [
        "ch-9-52"
      ]
    },
    {
      "number": 10,
      "title": "Behavior of the Self",
      "centerId": "g_identity",
      "channelIds": [
        "ch-10-20",
        "ch-10-34",
        "ch-10-57"
      ]
    },
    {
      "number": 11,
      "title": "Ideas",
      "centerId": "ajna",
      "channelIds": [
        "ch-11-56"
      ]
    },
    {
      "number": 12,
      "title": "Caution",
      "centerId": "throat",
      "channelIds": [
        "ch-12-22"
      ]
    },
    {
      "number": 13,
      "title": "Listener",
      "centerId": "g_identity",
      "channelIds": [
        "ch-13-33"
      ]
    },
    {
      "number": 14,
      "title": "Power Skills",
      "centerId": "sacral",
      "channelIds": [
        "ch-2-14"
      ]
    },
    {
      "number": 15,
      "title": "Extremes",
      "centerId": "g_identity",
      "channelIds": [
        "ch-5-15"
      ]
    },
    {
      "number": 16,
      "title": "Skills",
      "centerId": "throat",
      "channelIds": [
        "ch-48-16"
      ]
    },
    {
      "number": 17,
      "title": "Opinions",
      "centerId": "ajna",
      "channelIds": [
        "ch-17-62"
      ]
    },
    {
      "number": 18,
      "title": "Correction",
      "centerId": "spleen",
      "channelIds": [
        "ch-18-58"
      ]
    },
    {
      "number": 19,
      "title": "Wanting",
      "centerId": "root",
      "channelIds": [
        "ch-19-49"
      ]
    },
    {
      "number": 20,
      "title": "Now",
      "centerId": "throat",
      "channelIds": [
        "ch-10-20",
        "ch-34-20",
        "ch-57-20"
      ]
    },
    {
      "number": 21,
      "title": "Hunter/Huntress",
      "centerId": "heart",
      "channelIds": [
        "ch-21-45"
      ]
    },
    {
      "number": 22,
      "title": "Openness",
      "centerId": "solar_plexus",
      "channelIds": [
        "ch-12-22"
      ]
    },
    {
      "number": 23,
      "title": "Assimilation",
      "centerId": "throat",
      "channelIds": [
        "ch-43-23"
      ]
    },
    {
      "number": 24,
      "title": "Rationalizing",
      "centerId": "ajna",
      "channelIds": [
        "ch-61-24"
      ]
    },
    {
      "number": 25,
      "title": "Spirit of the Self",
      "centerId": "g_identity",
      "channelIds": [
        "ch-25-51"
      ]
    },
    {
      "number": 26,
      "title": "Egoist",
      "centerId": "heart",
      "channelIds": [
        "ch-26-44"
      ]
    },
    {
      "number": 27,
      "title": "Caring",
      "centerId": "sacral",
      "channelIds": [
        "ch-27-50"
      ]
    },
    {
      "number": 28,
      "title": "Game Player",
      "centerId": "spleen",
      "channelIds": [
        "ch-28-38"
      ]
    },
    {
      "number": 29,
      "title": "Saying Yes",
      "centerId": "sacral",
      "channelIds": [
        "ch-29-46"
      ]
    },
    {
      "number": 30,
      "title": "Recognition of Feelings",
      "centerId": "solar_plexus",
      "channelIds": [
        "ch-41-30"
      ]
    },
    {
      "number": 31,
      "title": "Leading",
      "centerId": "throat",
      "channelIds": [
        "ch-7-31"
      ]
    },
    {
      "number": 32,
      "title": "Continuity",
      "centerId": "spleen",
      "channelIds": [
        "ch-32-54"
      ]
    },
    {
      "number": 33,
      "title": "Privacy",
      "centerId": "throat",
      "channelIds": [
        "ch-13-33"
      ]
    },
    {
      "number": 34,
      "title": "Power",
      "centerId": "sacral",
      "channelIds": [
        "ch-34-20",
        "ch-10-34",
        "ch-34-57"
      ]
    },
    {
      "number": 35,
      "title": "Change",
      "centerId": "throat",
      "channelIds": [
        "ch-35-36"
      ]
    },
    {
      "number": 36,
      "title": "Crisis",
      "centerId": "solar_plexus",
      "channelIds": [
        "ch-35-36"
      ]
    },
    {
      "number": 37,
      "title": "Friendship",
      "centerId": "solar_plexus",
      "channelIds": [
        "ch-37-40"
      ]
    },
    {
      "number": 38,
      "title": "Fighter",
      "centerId": "root",
      "channelIds": [
        "ch-28-38"
      ]
    },
    {
      "number": 39,
      "title": "Provocateur",
      "centerId": "root",
      "channelIds": [
        "ch-39-55"
      ]
    },
    {
      "number": 40,
      "title": "Aloneness",
      "centerId": "heart",
      "channelIds": [
        "ch-37-40"
      ]
    },
    {
      "number": 41,
      "title": "Contraction",
      "centerId": "root",
      "channelIds": [
        "ch-41-30"
      ]
    },
    {
      "number": 42,
      "title": "Growth",
      "centerId": "sacral",
      "channelIds": [
        "ch-42-53"
      ]
    },
    {
      "number": 43,
      "title": "Insight",
      "centerId": "ajna",
      "channelIds": [
        "ch-43-23"
      ]
    },
    {
      "number": 44,
      "title": "Alertness",
      "centerId": "spleen",
      "channelIds": [
        "ch-26-44"
      ]
    },
    {
      "number": 45,
      "title": "Gatherer",
      "centerId": "throat",
      "channelIds": [
        "ch-21-45"
      ]
    },
    {
      "number": 46,
      "title": "Determination of the Self",
      "centerId": "g_identity",
      "channelIds": [
        "ch-29-46"
      ]
    },
    {
      "number": 47,
      "title": "Realizing",
      "centerId": "ajna",
      "channelIds": [
        "ch-64-47"
      ]
    },
    {
      "number": 48,
      "title": "Depth",
      "centerId": "spleen",
      "channelIds": [
        "ch-48-16"
      ]
    },
    {
      "number": 49,
      "title": "Principles",
      "centerId": "solar_plexus",
      "channelIds": [
        "ch-19-49"
      ]
    },
    {
      "number": 50,
      "title": "Values",
      "centerId": "spleen",
      "channelIds": [
        "ch-27-50"
      ]
    },
    {
      "number": 51,
      "title": "Shock",
      "centerId": "heart",
      "channelIds": [
        "ch-25-51"
      ]
    },
    {
      "number": 52,
      "title": "Inaction",
      "centerId": "root",
      "channelIds": [
        "ch-9-52"
      ]
    },
    {
      "number": 53,
      "title": "Beginnings",
      "centerId": "root",
      "channelIds": [
        "ch-42-53"
      ]
    },
    {
      "number": 54,
      "title": "Ambition",
      "centerId": "root",
      "channelIds": [
        "ch-32-54"
      ]
    },
    {
      "number": 55,
      "title": "Spirit",
      "centerId": "solar_plexus",
      "channelIds": [
        "ch-39-55"
      ]
    },
    {